id	version	source	line	object	variant	name	type	pattern	required	description
OAS-3.0.4-F0006	3.0.4	oas/3.0/3.0.4.md	265	OpenAPI Object	Fixed Fields	security	[Security Requirement Object]	false	false	A declaration of which security mechanisms can be used across the API. The list of values includes alternative Security Requirement Objects that can be used. Only one of the Security Requirement Objects need to be satisfied to authorize a request. Individual operations can override this definition. The list can be incomplete, up to being empty or absent. To make security explicitly optional, an empty security requirement (`{}`) can be included in the array.
OAS-3.0.4-F0007	3.0.4	oas/3.0/3.0.4.md	266	OpenAPI Object	Fixed Fields	tags	[Tag Object]	false	false	A list of tags used by the OpenAPI Description with additional metadata. The order of the tags can be used to reflect on their order by the parsing tools. Not all tags that are used by the [Operation Object](#operation-object) must be declared. The tags that are not declared MAY be organized randomly or based on the tools' logic. Each tag name in the list MUST be unique.
OAS-3.0.4-F0008	3.0.4	oas/3.0/3.0.4.md	267	OpenAPI Object	Fixed Fields	externalDocs	External Documentation Object	false	false	Additional external documentation.
OAS-3.0.4-F0009	3.0.4	oas/3.0/3.0.4.md	280	Info Object	Fixed Fields	title	string	false	true	**REQUIRED**. The title of the API.
OAS-3.0.4-F0010	3.0.4	oas/3.0/3.0.4.md	281	Info Object	Fixed Fields	description	string	false	false	A description of the API. [CommonMark syntax](https://spec.commonmark.org/) MAY be used for rich text representation.
OAS-3.0.4-F0011	3.0.4	oas/3.0/3.0.4.md	282	Info Object	Fixed Fields	termsOfService	string	false	false	A URL for the Terms of Service for the API. This MUST be in the form of a URL.
OAS-3.0.4-F0012	3.0.4	oas/3.0/3.0.4.md	283	Info Object	Fixed Fields	contact	Contact Object	false	false	The contact information for the exposed API.
OAS-3.0.4-F0013	3.0.4	oas/3.0/3.0.4.md	284	Info Object	Fixed Fields	license	License Object	false	false	The license information for the exposed API.
OAS-3.0.4-F0014	3.0.4	oas/3.0/3.0.4.md	285	Info Object	Fixed Fields	version	string	false	true	**REQUIRED**. The version of the OpenAPI Document (which is distinct from the [OpenAPI Specification version](#oas-version) or the version of the API being described or the version of the OpenAPI Description).
OAS-3.0.4-F0015	3.0.4	oas/3.0/3.0.4.md	331	Contact Object	Fixed Fields	name	string	false	false	The identifying name of the contact person/organization.
OAS-3.0.4-F0016	3.0.4	oas/3.0/3.0.4.md	332	Contact Object	Fixed Fields	url	string	false	false	The URL for the contact information. This MUST be in the form of a URL.
OAS-3.0.4-F0017	3.0.4	oas/3.0/3.0.4.md	333	Contact Object	Fixed Fields	email	string	false	false	The email address of the contact person/organization. This MUST be in the form of an email address.
OAS-3.0.4-F0018	3.0.4	oas/3.0/3.0.4.md	361	License Object	Fixed Fields	name	string	false	true	**REQUIRED**. The license name used for the API.
OAS-3.0.4-F0019	3.0.4	oas/3.0/3.0.4.md	362	License Object	Fixed Fields	url	string	false	false	A URL for the license used for the API. This MUST be in the form of a URL.
OAS-3.0.4-F0020	3.0.4	oas/3.0/3.0.4.md	388	Server Object	Fixed Fields	url	string	false	true	**REQUIRED**. A URL to the target host. This URL supports Server Variables and MAY be relative, to indicate that the host location is relative to the location where the document containing the Server Object is being served. Variable substitutions will be made when a variable is named in `{`braces`}`.
OAS-3.0.4-F0021	3.0.4	oas/3.0/3.0.4.md	389	Server Object	Fixed Fields	description	string	false	false	An optional string describing the host designated by the URL. [CommonMark syntax](https://spec.commonmark.org/) MAY be used for rich text representation.
OAS-3.0.4-F0022	3.0.4	oas/3.0/3.0.4.md	390	Server Object	Fixed Fields	variables	Map[string, Server Variable Object]	false	false	A map between a variable name and its value. The value is used for substitution in the server's URL template.
OAS-3.0.4-F0023	3.0.4	oas/3.0/3.0.4.md	494	Server Variable Object	Fixed Fields	enum	[string]	false	false	An enumeration of string values to be used if the substitution options are from a limited set. The array SHOULD NOT be empty.
OAS-3.0.4-F0024	3.0.4	oas/3.0/3.0.4.md	495	Server Variable Object	Fixed Fields	default	string	false	true	**REQUIRED**. The default value to use for substitution, which SHALL be sent if an alternate value is _not_ supplied. If the [`enum`](#server-variable-enum) is defined, the value SHOULD exist in the enum's values. Note that this behavior is different from the [Schema Object](#schema-object)'s `default` keyword, which documents the receiver's behavior rather than inserting the value into the data.
OAS-3.0.4-F0025	3.0.4	oas/3.0/3.0.4.md	496	Server Variable Object	Fixed Fields	description	string	false	false	An optional description for the server variable. [CommonMark syntax](https://spec.commonmark.org/) MAY be used for rich text representation.
OAS-3.0.4-F0026	3.0.4	oas/3.0/3.0.4.md	509	Components Object	Fixed Fields	schemas	Map[string, Schema Object | Reference Object]	false	false	An object to hold reusable [Schema Objects](#schema-object).
OAS-3.0.4-F0027	3.0.4	oas/3.0/3.0.4.md	510	Components Object	Fixed Fields	responses	Map[string, Response Object | Reference Object]	false	false	An object to hold reusable [Response Objects](#response-object).
OAS-3.0.4-F0028	3.0.4	oas/3.0/3.0.4.md	511	Components Object	Fixed Fields	parameters	Map[string, Parameter Object | Reference Object]	false	false	An object to hold reusable [Parameter Objects](#parameter-object).
OAS-3.0.4-F0029	3.0.4	oas/3.0/3.0.4.md	512	Components Object	Fixed Fields	examples	Map[string, Example Object | Reference Object]	false	false	An object to hold reusable [Example Objects](#example-object).
OAS-3.0.4-F0030	3.0.4	oas/3.0/3.0.4.md	513	Components Object	Fixed Fields	requestBodies	Map[string, Request Body Object | Reference Object]	false	false	An object to hold reusable [Request Body Objects](#request-body-object).
OAS-3.0.4-F0031	3.0.4	oas/3.0/3.0.4.md	514	Components Object	Fixed Fields	headers	Map[string, Header Object | Reference Object]	false	false	An object to hold reusable [Header Objects](#header-object).
OAS-3.0.4-F0032	3.0.4	oas/3.0/3.0.4.md	515	Components Object	Fixed Fields	securitySchemes	Map[string, Security Scheme Object | Reference Object]	false	false	An object to hold reusable [Security Scheme Objects](#security-scheme-object).
OAS-3.0.4-F0033	3.0.4	oas/3.0/3.0.4.md	516	Components Object	Fixed Fields	links	Map[string, Link Object | Reference Object]	false	false	An object to hold reusable [Link Objects](#link-object).
OAS-3.0.4-F0034	3.0.4	oas/3.0/3.0.4.md	517	Components Object	Fixed Fields	callbacks	Map[string, Callback Object | Reference Object]	false	false	An object to hold reusable [Callback Objects](#callback-object).
OAS-3.0.4-F0035	3.0.4	oas/3.0/3.0.4.md	716	Paths Object	Patterned Fields	/{path}	Path Item Object	true	false	A relative path to an individual endpoint. The field name MUST begin with a forward slash (`/`). The path is **appended** (no relative URL resolution) to the expanded URL from the [Server Object](#server-object)'s `url` field in order to construct the full URL. [Path templating](#path-templating) is allowed. When matching URLs, concrete (non-templated) paths would be matched before their templated counterparts. Templated paths with the same hierarchy but different templated names MUST NOT exist as they are identical. In case of ambiguous matching, it's up to the tooling to decide which one to use.
OAS-3.0.4-F0036	3.0.4	oas/3.0/3.0.4.md	795	Path Item Object	Fixed Fields	$ref	string	false	false	Allows for a referenced definition of this path item. The value MUST be in the form of a URL, and the referenced structure MUST be in the form of a [Path Item Object](#path-item-object). In case a Path Item Object field appears both in the defined object and the referenced object, the behavior is undefined. See the rules for resolving [Relative References](#relative-references-in-urls).
OAS-3.0.4-F0037	3.0.4	oas/3.0/3.0.4.md	796	Path Item Object	Fixed Fields	summary	string	false	false	An optional string summary, intended to apply to all operations in this path.
OAS-3.0.4-F0038	3.0.4	oas/3.0/3.0.4.md	797	Path Item Object	Fixed Fields	description	string	false	false	An optional string description, intended to apply to all operations in this path. [CommonMark syntax](https://spec.commonmark.org/) MAY be used for rich text representation.
OAS-3.0.4-F0039	3.0.4	oas/3.0/3.0.4.md	798	Path Item Object	Fixed Fields	get	Operation Object	false	false	A definition of a GET operation on this path.
OAS-3.0.4-F0040	3.0.4	oas/3.0/3.0.4.md	799	Path Item Object	Fixed Fields	put	Operation Object	false	false	A definition of a PUT operation on this path.
OAS-3.0.4-F0041	3.0.4	oas/3.0/3.0.4.md	800	Path Item Object	Fixed Fields	post	Operation Object	false	false	A definition of a POST operation on this path.
OAS-3.0.4-F0042	3.0.4	oas/3.0/3.0.4.md	801	Path Item Object	Fixed Fields	delete	Operation Object	false	false	A definition of a DELETE operation on this path.
OAS-3.0.4-F0043	3.0.4	oas/3.0/3.0.4.md	802	Path Item Object	Fixed Fields	options	Operation Object	false	false	A definition of a OPTIONS operation on this path.
OAS-3.0.4-F0044	3.0.4	oas/3.0/3.0.4.md	803	Path Item Object	Fixed Fields	head	Operation Object	false	false	A definition of a HEAD operation on this path.
OAS-3.0.4-F0045	3.0.4	oas/3.0/3.0.4.md	804	Path Item Object	Fixed Fields	patch	Operation Object	false	false	A definition of a PATCH operation on this path.
OAS-3.0.4-F0046	3.0.4	oas/3.0/3.0.4.md	805	Path Item Object	Fixed Fields	trace	Operation Object	false	false	A definition of a TRACE operation on this path.
OAS-3.0.4-F0047	3.0.4	oas/3.0/3.0.4.md	806	Path Item Object	Fixed Fields	servers	[Server Object]	false	false	An alternative `servers` array to service all operations in this path. If a `servers` array is specified at the [OpenAPI Object](#oas-servers) level, it will be overridden by this value.
OAS-3.0.4-F0048	3.0.4	oas/3.0/3.0.4.md	807	Path Item Object	Fixed Fields	parameters	[Parameter Object | Reference Object]	false	false	A list of parameters that are applicable for all the operations described under this path. These parameters can be overridden at the operation level, but cannot be removed there. The list MUST NOT include duplicated parameters. A unique parameter is defined by a combination of a [name](#parameter-name) and [location](#parameter-in). The list can use the [Reference Object](#reference-object) to link to parameters that are defined in the [OpenAPI Object's `components.parameters`](#components-parameters).
OAS-3.0.4-F0049	3.0.4	oas/3.0/3.0.4.md	903	Operation Object	Fixed Fields	tags	[string]	false	false	A list of tags for API documentation control. Tags can be used for logical grouping of operations by resources or any other qualifier.
OAS-3.0.4-F0050	3.0.4	oas/3.0/3.0.4.md	904	Operation Object	Fixed Fields	summary	string	false	false	A short summary of what the operation does.
OAS-3.0.4-F0051	3.0.4	oas/3.0/3.0.4.md	905	Operation Object	Fixed Fields	description	string	false	false	A verbose explanation of the operation behavior. [CommonMark syntax](https://spec.commonmark.org/) MAY be used for rich text representation.
OAS-3.0.4-F0052	3.0.4	oas/3.0/3.0.4.md	906	Operation Object	Fixed Fields	externalDocs	External Documentation Object	false	false	Additional external documentation for this operation.
OAS-3.0.4-F0053	3.0.4	oas/3.0/3.0.4.md	907	Operation Object	Fixed Fields	operationId	string	false	false	Unique string used to identify the operation. The id MUST be unique among all operations described in the API. The operationId value is **case-sensitive**. Tools and libraries MAY use the operationId to uniquely identify an operation, therefore, it is RECOMMENDED to follow common programming naming conventions.
OAS-3.0.4-F0054	3.0.4	oas/3.0/3.0.4.md	908	Operation Object	Fixed Fields	parameters	[Parameter Object | Reference Object]	false	false	A list of parameters that are applicable for this operation. If a parameter is already defined in the [Path Item](#path-item-parameters), the new definition will override it but can never remove it. The list MUST NOT include duplicated parameters. A unique parameter is defined by a combination of a [name](#parameter-name) and [location](#parameter-in). The list can use the [Reference Object](#reference-object) to link to parameters that are defined in the [OpenAPI Object's `components.parameters`](#components-parameters).
OAS-3.0.4-F0055	3.0.4	oas/3.0/3.0.4.md	909	Operation Object	Fixed Fields	requestBody	Request Body Object | Reference Object	false	false	The request body applicable for this operation. The `requestBody` is only supported in HTTP methods where the HTTP 1.1 specification [RFC7231](https://tools.ietf.org/html/rfc7231#section-4.3.1) has explicitly defined semantics for request bodies. In other cases where the HTTP spec is vague (such as [GET](https://tools.ietf.org/html/rfc7231#section-4.3.1), [HEAD](https://tools.ietf.org/html/rfc7231#section-4.3.2) and [DELETE](https://tools.ietf.org/html/rfc7231#section-4.3.5)), `requestBody` SHALL be ignored by consumers.
OAS-3.0.4-F0056	3.0.4	oas/3.0/3.0.4.md	910	Operation Object	Fixed Fields	responses	Responses Object	false	true	**REQUIRED**. The list of possible responses as they are returned from executing this operation.
OAS-3.0.4-F0057	3.0.4	oas/3.0/3.0.4.md	911	Operation Object	Fixed Fields	callbacks	Map[string, Callback Object | Reference Object]	false	false	A map of possible out-of band callbacks related to the parent operation. The key is a unique identifier for the Callback Object. Each value in the map is a [Callback Object](#callback-object) that describes a request that may be initiated by the API provider and the expected responses.
OAS-3.0.4-F0058	3.0.4	oas/3.0/3.0.4.md	912	Operation Object	Fixed Fields	deprecated	boolean	false	false	Declares this operation to be deprecated. Consumers SHOULD refrain from usage of the declared operation. Default value is `false`.
OAS-3.0.4-F0059	3.0.4	oas/3.0/3.0.4.md	913	Operation Object	Fixed Fields	security	[Security Requirement Object]	false	false	A declaration of which security mechanisms can be used for this operation. The list of values includes alternative Security Requirement Objects that can be used. Only one of the Security Requirement Objects need to be satisfied to authorize a request. To make security optional, an empty security requirement (`{}`) can be included in the array. This definition overrides any declared top-level [`security`](#oas-security). To remove a top-level security declaration, an empty array can be used.
OAS-3.0.4-F0060	3.0.4	oas/3.0/3.0.4.md	914	Operation Object	Fixed Fields	servers	[Server Object]	false	false	An alternative `servers` array to service this operation. If a `servers` array is specified at the [Path Item Object](#path-item-servers) or [OpenAPI Object](#oas-servers) level, it will be overridden by this value.
OAS-3.0.4-F0061	3.0.4	oas/3.0/3.0.4.md	1031	External Documentation Object	Fixed Fields	description	string	false	false	A description of the target documentation. [CommonMark syntax](https://spec.commonmark.org/) MAY be used for rich text representation.
OAS-3.0.4-F0062	3.0.4	oas/3.0/3.0.4.md	1032	External Documentation Object	Fixed Fields	url	string	false	true	**REQUIRED**. The URL for the target documentation. This MUST be in the form of a URL.
OAS-3.0.4-F0063	3.0.4	oas/3.0/3.0.4.md	1079	Parameter Object	Common Fixed Fields	name	string	false	true	"**REQUIRED**. The name of the parameter. Parameter names are _case sensitive_. <ul><li>If [`in`](#parameter-in) is `""path""`, the `name` field MUST correspond to a template expression occurring within the [path](#paths-path) field in the [Paths Object](#paths-object). See [Path Templating](#path-templating) for further information.<li>If [`in`](#parameter-in) is `""header""` and the `name` field is `""Accept""`, `""Content-Type""` or `""Authorization""`, the parameter definition SHALL be ignored.<li>For all other cases, the `name` corresponds to the parameter name used by the [`in`](#parameter-in) field.</ul>"
OAS-3.0.4-F0064	3.0.4	oas/3.0/3.0.4.md	1080	Parameter Object	Common Fixed Fields	in	string	false	true	"**REQUIRED**. The location of the parameter. Possible values are `""query""`, `""header""`, `""path""` or `""cookie""`."
OAS-3.0.4-F0065	3.0.4	oas/3.0/3.0.4.md	1081	Parameter Object	Common Fixed Fields	description	string	false	false	A brief description of the parameter. This could contain examples of use. [CommonMark syntax](https://spec.commonmark.org/) MAY be used for rich text representation.
OAS-3.0.4-F0066	3.0.4	oas/3.0/3.0.4.md	1082	Parameter Object	Common Fixed Fields	required	boolean	false	true	"Determines whether this parameter is mandatory. If the [parameter location](#parameter-in) is `""path""`, this field is **REQUIRED** and its value MUST be `true`. Otherwise, the field MAY be included and its default value is `false`."
OAS-3.0.4-F0067	3.0.4	oas/3.0/3.0.4.md	1083	Parameter Object	Common Fixed Fields	deprecated	boolean	false	false	Specifies that a parameter is deprecated and SHOULD be transitioned out of usage. Default value is `false`.
OAS-3.0.4-F0068	3.0.4	oas/3.0/3.0.4.md	1084	Parameter Object	Common Fixed Fields	allowEmptyValue	boolean	false	false	If `true`, clients MAY pass a zero-length string value in place of parameters that would otherwise be omitted entirely, which the server SHOULD interpret as the parameter being unused. Default value is `false`. If [`style`](#parameter-style) is used, and if [behavior is _n/a_ (cannot be serialized)](#style-examples), the value of `allowEmptyValue` SHALL be ignored. Interactions between this field and the parameter's [Schema Object](#schema-object) are implementation-defined. This field is valid only for `query` parameters. Use of this field is NOT RECOMMENDED, and it is likely to be removed in a later revision.
OAS-3.0.4-F0069	3.0.4	oas/3.0/3.0.4.md	1100	Parameter Object	Fixed Fields for use with schema	style	string	false	false	"Describes how the parameter value will be serialized depending on the type of the parameter value. Default values (based on value of `in`): for `""query""` - `""form""`; for `""path""` - `""simple""`; for `""header""` - `""simple""`; for `""cookie""` - `""form""`."
OAS-3.0.4-F0070	3.0.4	oas/3.0/3.0.4.md	1101	Parameter Object	Fixed Fields for use with schema	explode	boolean	false	false	"When this is true, parameter values of type `array` or `object` generate separate parameters for each value of the array or key-value pair of the map. For other types of parameters this field has no effect. When [`style`](#parameter-style) is `""form""`, the default value is `true`. For all other styles, the default value is `false`. Note that despite `false` being the default for `deepObject`, the combination of `false` with `deepObject` is undefined."
OAS-3.0.4-F0071	3.0.4	oas/3.0/3.0.4.md	1102	Parameter Object	Fixed Fields for use with schema	allowReserved	boolean	false	false	When this is true, parameter values are serialized using reserved expansion, as defined by [RFC6570](https://datatracker.ietf.org/doc/html/rfc6570#section-3.2.3), which allows [RFC3986's reserved character set](https://datatracker.ietf.org/doc/html/rfc3986#section-2.2), as well as percent-encoded triples, to pass through unchanged, while still percent-encoding all other disallowed characters (including `%` outside of percent-encoded triples). Applications are still responsible for percent-encoding reserved characters that are [not allowed in the query string](https://datatracker.ietf.org/doc/html/rfc3986#section-3.4) (`[`, `]`, `#`), or have a special meaning in `application/x-www-form-urlencoded` (`-`, `&`, `+`); see Appendices [C](#appendix-c-using-rfc6570-based-serialization) and [E](#appendix-e-percent-encoding-and-form-media-types) for details. This field only applies to parameters with an `in` value of `query`. The default value is `false`.
OAS-3.0.4-F0072	3.0.4	oas/3.0/3.0.4.md	1103	Parameter Object	Fixed Fields for use with schema	schema	Schema Object | Reference Object	false	false	The schema defining the type used for the parameter.
OAS-3.0.4-F0073	3.0.4	oas/3.0/3.0.4.md	1104	Parameter Object	Fixed Fields for use with schema	example	Any	false	false	Example of the parameter's potential value; see [Working With Examples](#working-with-examples).
OAS-3.0.4-F0074	3.0.4	oas/3.0/3.0.4.md	1105	Parameter Object	Fixed Fields for use with schema	examples	Map[ string, Example Object | Reference Object]	false	false	Examples of the parameter's potential value; see [Working With Examples](#working-with-examples).
OAS-3.0.4-F0075	3.0.4	oas/3.0/3.0.4.md	1116	Parameter Object	Fixed Fields for use with content	content	Map[string, Media Type Object]	false	false	A map containing the representations for the parameter. The key is the media type and the value describes it. The map MUST only contain one entry.
OAS-3.0.4-F0076	3.0.4	oas/3.0/3.0.4.md	1335	Request Body Object	Fixed Fields	description	string	false	false	A brief description of the request body. This could contain examples of use. [CommonMark syntax](https://spec.commonmark.org/) MAY be used for rich text representation.
OAS-3.0.4-F0077	3.0.4	oas/3.0/3.0.4.md	1336	Request Body Object	Fixed Fields	content	Map[string, Media Type Object]	false	true	"**REQUIRED**. The content of the request body. The key is a media type or [media type range](https://tools.ietf.org/html/rfc7231#appendix-D) and the value describes it. For requests that match multiple keys, only the most specific key is applicable. e.g. `""text/plain""` overrides `""text/*""`"
OAS-3.0.4-F0078	3.0.4	oas/3.0/3.0.4.md	1337	Request Body Object	Fixed Fields	required	boolean	false	true	Determines if the request body is required in the request. Defaults to `false`.
OAS-3.0.4-F0079	3.0.4	oas/3.0/3.0.4.md	1432	Media Type Object	Fixed Fields	schema	Schema Object | Reference Object	false	false	The schema defining the content of the request, response, parameter, or header.
OAS-3.0.4-F0080	3.0.4	oas/3.0/3.0.4.md	1433	Media Type Object	Fixed Fields	example	Any	false	false	Example of the media type; see [Working With Examples](#working-with-examples).
OAS-3.0.4-F0081	3.0.4	oas/3.0/3.0.4.md	1434	Media Type Object	Fixed Fields	examples	Map[ string, Example Object | Reference Object]	false	false	Examples of the media type; see [Working With Examples](#working-with-examples).
OAS-3.0.4-F0082	3.0.4	oas/3.0/3.0.4.md	1435	Media Type Object	Fixed Fields	encoding	Map[string, Encoding Object]	false	false	A map between a property name and its encoding information. The key, being the property name, MUST exist in the schema as a property. The `encoding` field SHALL only apply to [Request Body Objects](#request-body-object), and only when the media type is `multipart` or `application/x-www-form-urlencoded`. If no Encoding Object is provided for a property, the behavior is determined by the default values documented for the Encoding Object.
OAS-3.0.4-F0083	3.0.4	oas/3.0/3.0.4.md	1571	Encoding Object	Common Fixed Fields	contentType	string	false	false	The `Content-Type` for encoding a specific property. The value is a comma-separated list, each element of which is either a specific media type (e.g. `image/png`) or a wildcard media type (e.g. `image/*`). Default value depends on the property type as shown in the table below.
OAS-3.0.4-F0084	3.0.4	oas/3.0/3.0.4.md	1572	Encoding Object	Common Fixed Fields	headers	Map[string, Header Object | Reference Object]	false	false	A map allowing additional information to be provided as headers. `Content-Type` is described separately and SHALL be ignored in this section. This field SHALL be ignored if the request body media type is not a `multipart`.
OAS-3.0.4-F0085	3.0.4	oas/3.0/3.0.4.md	1594	Encoding Object	Fixed Fields for RFC6570-style Serialization	style	string	false	false	Describes how a specific property value will be serialized depending on its type. See [Parameter Object](#parameter-object) for details on the [`style`](#parameter-style) field. The behavior follows the same values as `query` parameters, including default values. Note that the initial `?` used in query strings is not used in `application/x-www-form-urlencoded` message bodies, and MUST be removed (if using an RFC6570 implementation) or simply not added (if constructing the string manually). This field SHALL be ignored if the request body media type is not `application/x-www-form-urlencoded`.
OAS-3.0.4-F0086	3.0.4	oas/3.0/3.0.4.md	1595	Encoding Object	Fixed Fields for RFC6570-style Serialization	explode	boolean	false	false	"When this is true, property values of type `array` or `object` generate separate parameters for each value of the array, or key-value-pair of the map. For other types of properties this field has no effect. When [`style`](#encoding-style) is `""form""`, the default value is `true`. For all other styles, the default value is `false`. Note that despite `false` being the default for `deepObject`, the combination of `false` with `deepObject` is undefined. This field SHALL be ignored if the request body media type is not `application/x-www-form-urlencoded`."
