id	version	source	line	object	variant	name	type	pattern	required	description
OAS-3.0.1-F0079	3.0.1	oas/3.0/3.0.1.md	1345	Media Type Object	Fixed Fields	schema	Schema Object | Reference Object	false	false	The schema defining the type used for the request body.
OAS-3.0.1-F0080	3.0.1	oas/3.0/3.0.1.md	1346	Media Type Object	Fixed Fields	example	Any	false	false	Example of the media type. The example object SHOULD be in the correct format as specified by the media type. The `example` field is mutually exclusive of the `examples` field. Furthermore, if referencing a `schema` which contains an example, the `example` value SHALL _override_ the example provided by the schema.
OAS-3.0.1-F0081	3.0.1	oas/3.0/3.0.1.md	1347	Media Type Object	Fixed Fields	examples	Map[ string, Example Object | Reference Object]	false	false	Examples of the media type. Each example object SHOULD match the media type and specified schema if present. The `examples` field is mutually exclusive of the `example` field. Furthermore, if referencing a `schema` which contains an example, the `examples` value SHALL _override_ the example provided by the schema.
OAS-3.0.1-F0082	3.0.1	oas/3.0/3.0.1.md	1348	Media Type Object	Fixed Fields	encoding	Map[string, Encoding Object]	false	false	A map between a property name and its encoding information. The key, being the property name, MUST exist in the schema as a property. The encoding object SHALL only apply to `requestBody` objects when the media type is `multipart` or `application/x-www-form-urlencoded`.
OAS-3.0.1-F0083	3.0.1	oas/3.0/3.0.1.md	1559	Encoding Object	Fixed Fields	contentType	string	false	false	The Content-Type for encoding a specific property. Default value depends on the property type: for `string` with `format` being `binary` – `application/octet-stream`; for other primitive types – `text/plain`; for `object` - `application/json`; for `array` – the default is defined based on the inner type. The value can be a specific media type (e.g. `application/json`), a wildcard media type (e.g. `image/*`), or a comma-separated list of the two types.
OAS-3.0.1-F0084	3.0.1	oas/3.0/3.0.1.md	1560	Encoding Object	Fixed Fields	headers	Map[string, Header Object | Reference Object]	false	false	A map allowing additional information to be provided as headers, for example `Content-Disposition`. `Content-Type` is described separately and SHALL be ignored in this section. This property SHALL be ignored if the request body media type is not a `multipart`.
OAS-3.0.1-F0085	3.0.1	oas/3.0/3.0.1.md	1561	Encoding Object	Fixed Fields	style	string	false	false	Describes how a specific property value will be serialized depending on its type. See [Parameter Object](#parameter-object) for details on the [`style`](#parameterStyle) property. The behavior follows the same values as `query` parameters, including default values. This property SHALL be ignored if the request body media type is not `application/x-www-form-urlencoded`.
OAS-3.0.1-F0086	3.0.1	oas/3.0/3.0.1.md	1562	Encoding Object	Fixed Fields	explode	boolean	false	false	When this is true, property values of type `array` or `object` generate separate parameters for each value of the array, or key-value-pair of the map. For other types of properties this property has no effect. When [`style`](#encodingStyle) is `form`, the default value is `true`. For all other styles, the default value is `false`. This property SHALL be ignored if the request body media type is not `application/x-www-form-urlencoded`.
OAS-3.0.1-F0087	3.0.1	oas/3.0/3.0.1.md	1563	Encoding Object	Fixed Fields	allowReserved	boolean	false	false	Determines whether the parameter value SHOULD allow reserved characters, as defined by [RFC3986](https://tools.ietf.org/html/rfc3986#section-2.2) `:/?#[]@!$&'()*+,;=` to be included without percent-encoding. The default value is `false`. This property SHALL be ignored if the request body media type is not `application/x-www-form-urlencoded`.
OAS-3.0.1-F0088	3.0.1	oas/3.0/3.0.1.md	1624	Responses Object	Fixed Fields	default	Response Object | Reference Object	false	false	The documentation of responses other than the ones declared for specific HTTP response codes. Use this field to cover undeclared responses. A [Reference Object](#reference-object) can link to a response that the [OpenAPI Object's components/responses](#componentsResponses) section defines.
OAS-3.0.1-F0089	3.0.1	oas/3.0/3.0.1.md	1629	Responses Object	Patterned Fields	HTTP Status Code	Response Object | Reference Object	true	false	"Any [HTTP status code](#http-status-codes) can be used as the property name, but only one property per code, to describe the expected response for that HTTP status code. A [Reference Object](#reference-object) can link to a response that is defined in the [OpenAPI Object's components/responses](#componentsResponses) section. This field MUST be enclosed in quotation marks (for example, ""200"") for compatibility between JSON and YAML. To define a range of response codes, this field MAY contain the uppercase wildcard character `X`. For example, `2XX` represents all response codes between `[200-299]`. The following range definitions are allowed: `1XX`, `2XX`, `3XX`, `4XX`, and `5XX`. If a response range is defined using an explicit code, the explicit code definition takes precedence over the range definition for that code."
OAS-3.0.1-F0090	3.0.1	oas/3.0/3.0.1.md	1685	Response Object	Fixed Fields	description	string	false	true	**REQUIRED**. A short description of the response. [CommonMark syntax](http://spec.commonmark.org/) MAY be used for rich text representation.
OAS-3.0.1-F0091	3.0.1	oas/3.0/3.0.1.md	1686	Response Object	Fixed Fields	headers	Map[string, Header Object | Reference Object]	false	false	"Maps a header name to its definition. [RFC7230](https://tools.ietf.org/html/rfc7230#page-22) states header names are case insensitive. If a response header is defined with the name `""Content-Type""`, it SHALL be ignored."
OAS-3.0.1-F0092	3.0.1	oas/3.0/3.0.1.md	1687	Response Object	Fixed Fields	content	Map[string, Media Type Object]	false	false	A map containing descriptions of potential response payloads. The key is a media type or [media type range](https://tools.ietf.org/html/rfc7231#appendix-D) and the value describes it. For responses that match multiple keys, only the most specific key is applicable. e.g. text/plain overrides text/*
OAS-3.0.1-F0093	3.0.1	oas/3.0/3.0.1.md	1688	Response Object	Fixed Fields	links	Map[string, Link Object | Reference Object]	false	false	A map of operations links that can be followed from the response. The key of the map is a short name for the link, following the naming constraints of the names for [Component Objects](#components-object).
OAS-3.0.1-F0094	3.0.1	oas/3.0/3.0.1.md	1824	Callback Object	Patterned Fields	{expression}	Path Item Object	true	false	A Path Item Object used to define a callback request and expected responses. A [complete example](../examples/v3.0/callback-example.yaml) is available.
OAS-3.0.1-F0095	3.0.1	oas/3.0/3.0.1.md	1895	Example Object	Fixed Fields	summary	string	false	false	Short description for the example.
OAS-3.0.1-F0096	3.0.1	oas/3.0/3.0.1.md	1896	Example Object	Fixed Fields	description	string	false	false	Long description for the example. [CommonMark syntax](http://spec.commonmark.org/) MAY be used for rich text representation.
OAS-3.0.1-F0097	3.0.1	oas/3.0/3.0.1.md	1897	Example Object	Fixed Fields	value	Any	false	false	Embedded literal example. The `value` field and `externalValue` field are mutually exclusive. To represent examples of media types that cannot naturally represented in JSON or YAML, use a string value to contain the example, escaping where necessary.
OAS-3.0.1-F0098	3.0.1	oas/3.0/3.0.1.md	1898	Example Object	Fixed Fields	externalValue	string	false	false	A URL that points to the literal example. This provides the capability to reference examples that cannot easily be included in JSON or YAML documents. The `value` field and `externalValue` field are mutually exclusive.
OAS-3.0.1-F0099	3.0.1	oas/3.0/3.0.1.md	1981	Link Object	Fixed Fields	operationRef	string	false	false	A relative or absolute reference to an OAS operation. This field is mutually exclusive of the `operationId` field, and MUST point to an [Operation Object](#operation-object). Relative `operationRef` values MAY be used to locate an existing [Operation Object](#operation-object) in the OpenAPI definition.
OAS-3.0.1-F0100	3.0.1	oas/3.0/3.0.1.md	1982	Link Object	Fixed Fields	operationId	string	false	false	The name of an _existing_, resolvable OAS operation, as defined with a unique `operationId`. This field is mutually exclusive of the `operationRef` field.
OAS-3.0.1-F0101	3.0.1	oas/3.0/3.0.1.md	1983	Link Object	Fixed Fields	parameters	Map[string, Any | {expression}]	false	false	A map representing parameters to pass to an operation as specified with `operationId` or identified via `operationRef`. The key is the parameter name to be used, whereas the value can be a constant or an expression to be evaluated and passed to the linked operation. The parameter name can be qualified using the [parameter location](#parameterIn) `[{in}.]{name}` for operations that use the same parameter name in different locations (e.g. path.id).
OAS-3.0.1-F0102	3.0.1	oas/3.0/3.0.1.md	1984	Link Object	Fixed Fields	requestBody	Any | {expression}	false	false	A literal value or [{expression}](#runtime-expressions) to use as a request body when calling the target operation.
OAS-3.0.1-F0103	3.0.1	oas/3.0/3.0.1.md	1985	Link Object	Fixed Fields	description	string	false	false	A description of the link. [CommonMark syntax](http://spec.commonmark.org/) MAY be used for rich text representation.
OAS-3.0.1-F0104	3.0.1	oas/3.0/3.0.1.md	1986	Link Object	Fixed Fields	server	Server Object	false	false	A server object to be used by the target operation.
OAS-3.0.1-F0105	3.0.1	oas/3.0/3.0.1.md	2166	Tag Object	Fixed Fields	name	string	false	true	**REQUIRED**. The name of the tag.
OAS-3.0.1-F0106	3.0.1	oas/3.0/3.0.1.md	2167	Tag Object	Fixed Fields	description	string	false	false	A short description for the tag. [CommonMark syntax](http://spec.commonmark.org/) MAY be used for rich text representation.
OAS-3.0.1-F0107	3.0.1	oas/3.0/3.0.1.md	2168	Tag Object	Fixed Fields	externalDocs	External Documentation Object	false	false	Additional external documentation for this tag.
OAS-3.0.1-F0108	3.0.1	oas/3.0/3.0.1.md	2198	Reference Object	Fixed Fields	$ref	string	false	true	**REQUIRED**. The reference string.
OAS-3.0.1-F0109	3.0.1	oas/3.0/3.0.1.md	2288	Schema Object	Fixed Fields	nullable	boolean	false	false	Allows sending a `null` value for the defined schema. Default value is `false`.
OAS-3.0.1-F0110	3.0.1	oas/3.0/3.0.1.md	2289	Schema Object	Fixed Fields	discriminator	Discriminator Object	false	false	Adds support for polymorphism. The discriminator is an object name that is used to differentiate between other schemas which may satisfy the payload description. See [Composition and Inheritance](#composition-and-inheritance-polymorphism) for more details.
OAS-3.0.1-F0111	3.0.1	oas/3.0/3.0.1.md	2290	Schema Object	Fixed Fields	readOnly	boolean	false	true	"Relevant only for Schema `""properties""` definitions. Declares the property as ""read only"". This means that it MAY be sent as part of a response but SHOULD NOT be sent as part of the request. If the property is marked as `readOnly` being `true` and is in the `required` list, the `required` will take effect on the response only. A property MUST NOT be marked as both `readOnly` and `writeOnly` being `true`. Default value is `false`."
OAS-3.0.1-F0112	3.0.1	oas/3.0/3.0.1.md	2291	Schema Object	Fixed Fields	writeOnly	boolean	false	true	"Relevant only for Schema `""properties""` definitions. Declares the property as ""write only"". Therefore, it MAY be sent as part of a request but SHOULD NOT be sent as part of the response. If the property is marked as `writeOnly` being `true` and is in the `required` list, the `required` will take effect on the request only. A property MUST NOT be marked as both `readOnly` and `writeOnly` being `true`. Default value is `false`."
OAS-3.0.1-F0113	3.0.1	oas/3.0/3.0.1.md	2292	Schema Object	Fixed Fields	xml	XML Object	false	false	This MAY be used only on properties schemas. It has no effect on root schemas. Adds additional metadata to describe the XML representation of this property.
OAS-3.0.1-F0114	3.0.1	oas/3.0/3.0.1.md	2293	Schema Object	Fixed Fields	externalDocs	External Documentation Object	false	false	Additional external documentation for this schema.
OAS-3.0.1-F0115	3.0.1	oas/3.0/3.0.1.md	2294	Schema Object	Fixed Fields	example	Any	false	false	A free-form property to include an example of an instance for this schema. To represent examples that cannot be naturally represented in JSON or YAML, a string value can be used to contain the example with escaping where necessary.
OAS-3.0.1-F0116	3.0.1	oas/3.0/3.0.1.md	2295	Schema Object	Fixed Fields	deprecated	boolean	false	false	Specifies that a schema is deprecated and SHOULD be transitioned out of usage. Default value is `false`.
OAS-3.0.1-F0117	3.0.1	oas/3.0/3.0.1.md	2655	Discriminator Object	Fixed Fields	propertyName	string	false	true	**REQUIRED**. The name of the property in the payload that will hold the discriminator value.
OAS-3.0.1-F0118	3.0.1	oas/3.0/3.0.1.md	2656	Discriminator Object	Fixed Fields	mapping	Map[string, string]	false	false	An object to hold mappings between payload values and schema names or references.
OAS-3.0.1-F0119	3.0.1	oas/3.0/3.0.1.md	2789	XML Object	Fixed Fields	name	string	false	false	Replaces the name of the element/attribute used for the described schema property. When defined within `items`, it will affect the name of the individual XML elements within the list. When defined alongside `type` being `array` (outside the `items`), it will affect the wrapping element and only if `wrapped` is `true`. If `wrapped` is `false`, it will be ignored.
OAS-3.0.1-F0120	3.0.1	oas/3.0/3.0.1.md	2790	XML Object	Fixed Fields	namespace	string	false	false	The URI of the namespace definition. Value MUST be in the form of an absolute URI.
OAS-3.0.1-F0121	3.0.1	oas/3.0/3.0.1.md	2791	XML Object	Fixed Fields	prefix	string	false	false	The prefix to be used for the [name](#xmlName).
OAS-3.0.1-F0122	3.0.1	oas/3.0/3.0.1.md	2792	XML Object	Fixed Fields	attribute	boolean	false	false	Declares whether the property definition translates to an attribute instead of an element. Default value is `false`.
OAS-3.0.1-F0123	3.0.1	oas/3.0/3.0.1.md	2793	XML Object	Fixed Fields	wrapped	boolean	false	false	MAY be used only for an array definition. Signifies whether the array is wrapped (for example, `<books><book/><book/></books>`) or unwrapped (`<book/><book/>`). Default value is `false`. The definition takes effect only when defined alongside `type` being `array` (outside the `items`).
OAS-3.0.1-F0124	3.0.1	oas/3.0/3.0.1.md	3140	Security Scheme Object	Fixed Fields	type	string	false	true	"Any | **REQUIRED**. The type of the security scheme. Valid values are `""apiKey""`, `""http""`, `""oauth2""`, `""openIdConnect""`."
OAS-3.0.1-F0125	3.0.1	oas/3.0/3.0.1.md	3141	Security Scheme Object	Fixed Fields	description	string	false	false	Any | A short description for security scheme. [CommonMark syntax](http://spec.commonmark.org/) MAY be used for rich text representation.
OAS-3.0.1-F0126	3.0.1	oas/3.0/3.0.1.md	3142	Security Scheme Object	Fixed Fields	name	string	false	true	`apiKey` | **REQUIRED**. The name of the header, query or cookie parameter to be used.
OAS-3.0.1-F0127	3.0.1	oas/3.0/3.0.1.md	3143	Security Scheme Object	Fixed Fields	in	string	false	true	"`apiKey` | **REQUIRED**. The location of the API key. Valid values are `""query""`, `""header""` or `""cookie""`."
OAS-3.0.1-F0128	3.0.1	oas/3.0/3.0.1.md	3144	Security Scheme Object	Fixed Fields	scheme	string	false	true	`http` | **REQUIRED**. The name of the HTTP Authorization scheme to be used in the [Authorization header as defined in RFC7235](https://tools.ietf.org/html/rfc7235#section-5.1).
OAS-3.0.1-F0129	3.0.1	oas/3.0/3.0.1.md	3145	Security Scheme Object	Fixed Fields	bearerFormat	string	false	false	"`http` (`""bearer""`) | A hint to the client to identify how the bearer token is formatted. Bearer tokens are usually generated by an authorization server, so this information is primarily for documentation purposes."
OAS-3.0.1-F0130	3.0.1	oas/3.0/3.0.1.md	3146	Security Scheme Object	Fixed Fields	flows	OAuth Flows Object	false	true	`oauth2` | **REQUIRED**. An object containing configuration information for the flow types supported.
OAS-3.0.1-F0131	3.0.1	oas/3.0/3.0.1.md	3147	Security Scheme Object	Fixed Fields	openIdConnectUrl	string	false	true	`openIdConnect` | **REQUIRED**. OpenId Connect URL to discover OAuth2 configuration values. This MUST be in the form of a URL.
OAS-3.0.1-F0132	3.0.1	oas/3.0/3.0.1.md	3233	OAuth Flows Object	Fixed Fields	implicit	OAuth Flow Object	false	false	Configuration for the OAuth Implicit flow
OAS-3.0.1-F0133	3.0.1	oas/3.0/3.0.1.md	3234	OAuth Flows Object	Fixed Fields	password	OAuth Flow Object	false	false	Configuration for the OAuth Resource Owner Password flow
OAS-3.0.1-F0134	3.0.1	oas/3.0/3.0.1.md	3235	OAuth Flows Object	Fixed Fields	clientCredentials	OAuth Flow Object	false	false	Configuration for the OAuth Client Credentials flow. Previously called `application` in OpenAPI 2.0.
OAS-3.0.1-F0135	3.0.1	oas/3.0/3.0.1.md	3236	OAuth Flows Object	Fixed Fields	authorizationCode	OAuth Flow Object	false	false	Configuration for the OAuth Authorization Code flow. Previously called `accessCode` in OpenAPI 2.0.
OAS-3.0.1-F0136	3.0.1	oas/3.0/3.0.1.md	3247	OAuth Flow Object	Fixed Fields	authorizationUrl	string	false	true	"`oauth2` (`""implicit""`, `""authorizationCode""`) | **REQUIRED**. The authorization URL to be used for this flow. This MUST be in the form of a URL."
OAS-3.0.1-F0137	3.0.1	oas/3.0/3.0.1.md	3248	OAuth Flow Object	Fixed Fields	tokenUrl	string	false	true	"`oauth2` (`""password""`, `""clientCredentials""`, `""authorizationCode""`) | **REQUIRED**. The token URL to be used for this flow. This MUST be in the form of a URL."
OAS-3.0.1-F0138	3.0.1	oas/3.0/3.0.1.md	3249	OAuth Flow Object	Fixed Fields	refreshUrl	string	false	false	`oauth2` | The URL to be used for obtaining refresh tokens. This MUST be in the form of a URL.
OAS-3.0.1-F0139	3.0.1	oas/3.0/3.0.1.md	3250	OAuth Flow Object	Fixed Fields	scopes	Map[string, string]	false	true	`oauth2` | **REQUIRED**. The available scopes for the OAuth2 security scheme. A map between the scope name and a short description for it.
OAS-3.0.1-F0140	3.0.1	oas/3.0/3.0.1.md	3310	Security Requirement Object	Patterned Fields	{name}	[string]	true	true	"Each name MUST correspond to a security scheme which is declared in the [Security Schemes](#componentsSecuritySchemes) under the [Components Object](#components-object). If the security scheme is of type `""oauth2""` or `""openIdConnect""`, then the value is a list of scope names required for the execution. For other security scheme types, the array MUST be empty."
OAS-3.0.2-F0001	3.0.2	oas/3.0/3.0.2.md	193	OpenAPI Object	Fixed Fields	openapi	string	false	true	**REQUIRED**. This string MUST be the [semantic version number](https://semver.org/spec/v2.0.0.html) of the [OpenAPI Specification version](#versions) that the OpenAPI document uses. The `openapi` field SHOULD be used by tooling specifications and clients to interpret the OpenAPI document. This is *not* related to the API [`info.version`](#infoVersion) string.
OAS-3.0.2-F0002	3.0.2	oas/3.0/3.0.2.md	194	OpenAPI Object	Fixed Fields	info	Info Object	false	true	**REQUIRED**. Provides metadata about the API. The metadata MAY be used by tooling as required.
OAS-3.0.2-F0003	3.0.2	oas/3.0/3.0.2.md	195	OpenAPI Object	Fixed Fields	servers	[Server Object]	false	false	An array of Server Objects, which provide connectivity information to a target server. If the `servers` property is not provided, or is an empty array, the default value would be a [Server Object](#server-object) with a [url](#serverUrl) value of `/`.
OAS-3.0.2-F0004	3.0.2	oas/3.0/3.0.2.md	196	OpenAPI Object	Fixed Fields	paths	Paths Object	false	true	**REQUIRED**. The available paths and operations for the API.
OAS-3.0.2-F0005	3.0.2	oas/3.0/3.0.2.md	197	OpenAPI Object	Fixed Fields	components	Components Object	false	false	An element to hold various schemas for the specification.
OAS-3.0.2-F0006	3.0.2	oas/3.0/3.0.2.md	198	OpenAPI Object	Fixed Fields	security	[Security Requirement Object]	false	false	A declaration of which security mechanisms can be used across the API. The list of values includes alternative security requirement objects that can be used. Only one of the security requirement objects need to be satisfied to authorize a request. Individual operations can override this definition.
OAS-3.0.2-F0007	3.0.2	oas/3.0/3.0.2.md	199	OpenAPI Object	Fixed Fields	tags	[Tag Object]	false	false	A list of tags used by the specification with additional metadata. The order of the tags can be used to reflect on their order by the parsing tools. Not all tags that are used by the [Operation Object](#operation-object) must be declared. The tags that are not declared MAY be organized randomly or based on the tools' logic. Each tag name in the list MUST be unique.
OAS-3.0.2-F0008	3.0.2	oas/3.0/3.0.2.md	200	OpenAPI Object	Fixed Fields	externalDocs	External Documentation Object	false	false	Additional external documentation.
OAS-3.0.2-F0009	3.0.2	oas/3.0/3.0.2.md	213	Info Object	Fixed Fields	title	string	false	true	**REQUIRED**. The title of the application.
OAS-3.0.2-F0010	3.0.2	oas/3.0/3.0.2.md	214	Info Object	Fixed Fields	description	string	false	false	A short description of the application. [CommonMark syntax](http://spec.commonmark.org/) MAY be used for rich text representation.
OAS-3.0.2-F0011	3.0.2	oas/3.0/3.0.2.md	215	Info Object	Fixed Fields	termsOfService	string	false	false	A URL to the Terms of Service for the API. MUST be in the format of a URL.
OAS-3.0.2-F0012	3.0.2	oas/3.0/3.0.2.md	216	Info Object	Fixed Fields	contact	Contact Object	false	false	The contact information for the exposed API.
OAS-3.0.2-F0013	3.0.2	oas/3.0/3.0.2.md	217	Info Object	Fixed Fields	license	License Object	false	false	The license information for the exposed API.
OAS-3.0.2-F0014	3.0.2	oas/3.0/3.0.2.md	218	Info Object	Fixed Fields	version	string	false	true	**REQUIRED**. The version of the OpenAPI document (which is distinct from the [OpenAPI Specification version](#oasVersion) or the API implementation version).
OAS-3.0.2-F0015	3.0.2	oas/3.0/3.0.2.md	265	Contact Object	Fixed Fields	name	string	false	false	The identifying name of the contact person/organization.
OAS-3.0.2-F0016	3.0.2	oas/3.0/3.0.2.md	266	Contact Object	Fixed Fields	url	string	false	false	The URL pointing to the contact information. MUST be in the format of a URL.
OAS-3.0.2-F0017	3.0.2	oas/3.0/3.0.2.md	267	Contact Object	Fixed Fields	email	string	false	false	The email address of the contact person/organization. MUST be in the format of an email address.
OAS-3.0.2-F0018	3.0.2	oas/3.0/3.0.2.md	295	License Object	Fixed Fields	name	string	false	true	**REQUIRED**. The license name used for the API.
OAS-3.0.2-F0019	3.0.2	oas/3.0/3.0.2.md	296	License Object	Fixed Fields	url	string	false	false	A URL to the license used for the API. MUST be in the format of a URL.
OAS-3.0.2-F0020	3.0.2	oas/3.0/3.0.2.md	322	Server Object	Fixed Fields	url	string	false	true	**REQUIRED**. A URL to the target host. This URL supports Server Variables and MAY be relative, to indicate that the host location is relative to the location where the OpenAPI document is being served. Variable substitutions will be made when a variable is named in `{`brackets`}`.
OAS-3.0.2-F0021	3.0.2	oas/3.0/3.0.2.md	323	Server Object	Fixed Fields	description	string	false	false	An optional string describing the host designated by the URL. [CommonMark syntax](http://spec.commonmark.org/) MAY be used for rich text representation.
OAS-3.0.2-F0022	3.0.2	oas/3.0/3.0.2.md	324	Server Object	Fixed Fields	variables	Map[string, Server Variable Object]	false	false	A map between a variable name and its value. The value is used for substitution in the server's URL template.
OAS-3.0.2-F0023	3.0.2	oas/3.0/3.0.2.md	432	Server Variable Object	Fixed Fields	enum	[string]	false	false	An enumeration of string values to be used if the substitution options are from a limited set.
OAS-3.0.2-F0024	3.0.2	oas/3.0/3.0.2.md	433	Server Variable Object	Fixed Fields	default	string	false	true	**REQUIRED**. The default value to use for substitution, which SHALL be sent if an alternate value is _not_ supplied. Note this behavior is different than the [Schema Object's](#schema-object) treatment of default values, because in those cases parameter values are optional.
OAS-3.0.2-F0025	3.0.2	oas/3.0/3.0.2.md	434	Server Variable Object	Fixed Fields	description	string	false	false	An optional description for the server variable. [CommonMark syntax](http://spec.commonmark.org/) MAY be used for rich text representation.
OAS-3.0.2-F0026	3.0.2	oas/3.0/3.0.2.md	448	Components Object	Fixed Fields	schemas	Map[string, Schema Object | Reference Object]	false	false	An object to hold reusable [Schema Objects](#schema-object).
OAS-3.0.2-F0027	3.0.2	oas/3.0/3.0.2.md	449	Components Object	Fixed Fields	responses	Map[string, Response Object | Reference Object]	false	false	An object to hold reusable [Response Objects](#response-object).
OAS-3.0.2-F0028	3.0.2	oas/3.0/3.0.2.md	450	Components Object	Fixed Fields	parameters	Map[string, Parameter Object | Reference Object]	false	false	An object to hold reusable [Parameter Objects](#parameter-object).
OAS-3.0.2-F0029	3.0.2	oas/3.0/3.0.2.md	451	Components Object	Fixed Fields	examples	Map[string, Example Object | Reference Object]	false	false	An object to hold reusable [Example Objects](#example-object).
