id	version	source	line	object	variant	name	type	pattern	required	description
OAS-3.1.1-F0128	3.1.1	oas/3.1/3.1.1.md	2756	Schema Object	Fixed Fields	example	Any	false	false	A free-form field to include an example of an instance for this schema. To represent examples that cannot be naturally represented in JSON or YAML, a string value can be used to contain the example with escaping where necessary.<br><br>**Deprecated:** The `example` field has been deprecated in favor of the JSON Schema `examples` keyword. Use of `example` is discouraged, and later versions of this specification may remove it.
OAS-3.1.1-F0129	3.1.1	oas/3.1/3.1.1.md	3293	Discriminator Object	Fixed Fields	propertyName	string	false	true	**REQUIRED**. The name of the property in the payload that will hold the discriminating value. This property SHOULD be required in the payload schema, as the behavior when the property is absent is undefined.
OAS-3.1.1-F0130	3.1.1	oas/3.1/3.1.1.md	3294	Discriminator Object	Fixed Fields	mapping	Map[string, string]	false	false	An object to hold mappings between payload values and schema names or URI references.
OAS-3.1.1-F0131	3.1.1	oas/3.1/3.1.1.md	3452	XML Object	Fixed Fields	name	string	false	false	"Replaces the name of the element/attribute used for the described schema property. When defined within `items`, it will affect the name of the individual XML elements within the list. When defined alongside `type` being `""array""` (outside the `items`), it will affect the wrapping element if and only if `wrapped` is `true`. If `wrapped` is `false`, it will be ignored."
OAS-3.1.1-F0132	3.1.1	oas/3.1/3.1.1.md	3453	XML Object	Fixed Fields	namespace	string	false	false	The URI of the namespace definition. Value MUST be in the form of a non-relative URI.
OAS-3.1.1-F0133	3.1.1	oas/3.1/3.1.1.md	3454	XML Object	Fixed Fields	prefix	string	false	false	The prefix to be used for the [name](#xml-name).
OAS-3.1.1-F0134	3.1.1	oas/3.1/3.1.1.md	3455	XML Object	Fixed Fields	attribute	boolean	false	false	Declares whether the property definition translates to an attribute instead of an element. Default value is `false`.
OAS-3.1.1-F0135	3.1.1	oas/3.1/3.1.1.md	3456	XML Object	Fixed Fields	wrapped	boolean	false	false	"MAY be used only for an array definition. Signifies whether the array is wrapped (for example, `<books><book/><book/></books>`) or unwrapped (`<book/><book/>`). Default value is `false`. The definition takes effect only when defined alongside `type` being `""array""` (outside the `items`)."
OAS-3.1.1-F0136	3.1.1	oas/3.1/3.1.1.md	3812	Security Scheme Object	Fixed Fields	type	string	false	true	"Any | **REQUIRED**. The type of the security scheme. Valid values are `""apiKey""`, `""http""`, `""mutualTLS""`, `""oauth2""`, `""openIdConnect""`."
OAS-3.1.1-F0137	3.1.1	oas/3.1/3.1.1.md	3813	Security Scheme Object	Fixed Fields	description	string	false	false	Any | A description for security scheme. [CommonMark syntax](https://spec.commonmark.org/) MAY be used for rich text representation.
OAS-3.1.1-F0138	3.1.1	oas/3.1/3.1.1.md	3814	Security Scheme Object	Fixed Fields	name	string	false	true	`apiKey` | **REQUIRED**. The name of the header, query or cookie parameter to be used.
OAS-3.1.1-F0139	3.1.1	oas/3.1/3.1.1.md	3815	Security Scheme Object	Fixed Fields	in	string	false	true	"`apiKey` | **REQUIRED**. The location of the API key. Valid values are `""query""`, `""header""`, or `""cookie""`."
OAS-3.1.1-F0140	3.1.1	oas/3.1/3.1.1.md	3816	Security Scheme Object	Fixed Fields	scheme	string	false	true	`http` | **REQUIRED**. The name of the HTTP Authentication scheme to be used in the [Authorization header as defined in RFC7235](https://tools.ietf.org/html/rfc7235#section-5.1). The values used SHOULD be registered in the [IANA Authentication Scheme registry](https://www.iana.org/assignments/http-authschemes/http-authschemes.xhtml). The value is case-insensitive, as defined in [RFC7235](https://datatracker.ietf.org/doc/html/rfc7235#section-2.1).
OAS-3.1.1-F0141	3.1.1	oas/3.1/3.1.1.md	3817	Security Scheme Object	Fixed Fields	bearerFormat	string	false	false	"`http` (`""bearer""`) | A hint to the client to identify how the bearer token is formatted. Bearer tokens are usually generated by an authorization server, so this information is primarily for documentation purposes."
OAS-3.1.1-F0142	3.1.1	oas/3.1/3.1.1.md	3818	Security Scheme Object	Fixed Fields	flows	OAuth Flows Object	false	true	`oauth2` | **REQUIRED**. An object containing configuration information for the flow types supported.
OAS-3.1.1-F0143	3.1.1	oas/3.1/3.1.1.md	3819	Security Scheme Object	Fixed Fields	openIdConnectUrl	string	false	true	`openIdConnect` | **REQUIRED**. [Well-known URL](https://openid.net/specs/openid-connect-discovery-1_0.html#ProviderConfig) to discover the [[OpenID-Connect-Discovery]] [provider metadata](https://openid.net/specs/openid-connect-discovery-1_0.html#ProviderMetadata).
OAS-3.1.1-F0144	3.1.1	oas/3.1/3.1.1.md	3920	OAuth Flows Object	Fixed Fields	implicit	OAuth Flow Object	false	false	Configuration for the OAuth Implicit flow
OAS-3.1.1-F0145	3.1.1	oas/3.1/3.1.1.md	3921	OAuth Flows Object	Fixed Fields	password	OAuth Flow Object	false	false	Configuration for the OAuth Resource Owner Password flow
OAS-3.1.1-F0146	3.1.1	oas/3.1/3.1.1.md	3922	OAuth Flows Object	Fixed Fields	clientCredentials	OAuth Flow Object	false	false	Configuration for the OAuth Client Credentials flow. Previously called `application` in OpenAPI 2.0.
OAS-3.1.1-F0147	3.1.1	oas/3.1/3.1.1.md	3923	OAuth Flows Object	Fixed Fields	authorizationCode	OAuth Flow Object	false	false	Configuration for the OAuth Authorization Code flow. Previously called `accessCode` in OpenAPI 2.0.
OAS-3.1.1-F0148	3.1.1	oas/3.1/3.1.1.md	3935	OAuth Flow Object	Fixed Fields	authorizationUrl	string	false	true	"`oauth2` (`""implicit""`, `""authorizationCode""`) | **REQUIRED**. The authorization URL to be used for this flow. This MUST be in the form of a URL. The OAuth2 standard requires the use of TLS."
OAS-3.1.1-F0149	3.1.1	oas/3.1/3.1.1.md	3936	OAuth Flow Object	Fixed Fields	tokenUrl	string	false	true	"`oauth2` (`""password""`, `""clientCredentials""`, `""authorizationCode""`) | **REQUIRED**. The token URL to be used for this flow. This MUST be in the form of a URL. The OAuth2 standard requires the use of TLS."
OAS-3.1.1-F0150	3.1.1	oas/3.1/3.1.1.md	3937	OAuth Flow Object	Fixed Fields	refreshUrl	string	false	false	`oauth2` | The URL to be used for obtaining refresh tokens. This MUST be in the form of a URL. The OAuth2 standard requires the use of TLS.
OAS-3.1.1-F0151	3.1.1	oas/3.1/3.1.1.md	3938	OAuth Flow Object	Fixed Fields	scopes	Map[string, string]	false	true	`oauth2` | **REQUIRED**. The available scopes for the OAuth2 security scheme. A map between the scope name and a short description for it. The map MAY be empty.
OAS-3.1.1-F0152	3.1.1	oas/3.1/3.1.1.md	4000	Security Requirement Object	Patterned Fields	{name}	[string]	true	true	"Each name MUST correspond to a security scheme which is declared in the [Security Schemes](#security-scheme-object) under the [Components Object](#components-object). If the security scheme is of type `""oauth2""` or `""openIdConnect""`, then the value is a list of scope names required for the execution, and the list MAY be empty if authorization does not require a specified scope. For other security scheme types, the array MAY contain a list of role names which are required for the execution, but are not otherwise defined or exchanged in-band."
OAS-3.1.2-F0001	3.1.2	oas/3.1/3.1.2.md	325	OpenAPI Object	Fixed Fields	openapi	string	false	true	**REQUIRED**. This string MUST be the [version number](#versions) of the OpenAPI Specification that the OpenAPI Document uses. The `openapi` field SHOULD be used by tooling to interpret the OpenAPI Document. This is _not_ related to the [`info.version`](#info-version) string, which is the version of the OpenAPI Document.
OAS-3.1.2-F0002	3.1.2	oas/3.1/3.1.2.md	326	OpenAPI Object	Fixed Fields	info	Info Object	false	true	**REQUIRED**. Provides metadata about the API. The metadata MAY be used by tooling as required.
OAS-3.1.2-F0003	3.1.2	oas/3.1/3.1.2.md	327	OpenAPI Object	Fixed Fields	jsonSchemaDialect	string	false	false	The default value for the `$schema` keyword within [Schema Objects](#schema-object) contained within this OAS document. This MUST be in the form of a URI.
OAS-3.1.2-F0004	3.1.2	oas/3.1/3.1.2.md	328	OpenAPI Object	Fixed Fields	servers	[Server Object]	false	false	An array of Server Objects, which provide connectivity information to a target server. If the `servers` field is not provided, or is an empty array, the default value would be a [Server Object](#server-object) with a [url](#server-url) value of `/`.
OAS-3.1.2-F0005	3.1.2	oas/3.1/3.1.2.md	329	OpenAPI Object	Fixed Fields	paths	Paths Object	false	false	The available paths and operations for the API.
OAS-3.1.2-F0006	3.1.2	oas/3.1/3.1.2.md	330	OpenAPI Object	Fixed Fields	webhooks	Map[string, Path Item Object]	false	false	The incoming webhooks that MAY be received as part of this API and that the API consumer MAY choose to implement. Closely related to the `callbacks` feature, this section describes requests initiated other than by an API call, for example by an out of band registration. The key name is a unique string to refer to each webhook, while the (optionally referenced) Path Item Object describes a request that may be initiated by the API provider and the expected responses. An [example](https://learn.openapis.org/examples/v3.1/webhook-example.html) is available.
OAS-3.1.2-F0007	3.1.2	oas/3.1/3.1.2.md	331	OpenAPI Object	Fixed Fields	components	Components Object	false	false	An element to hold various Objects for the OpenAPI Description.
OAS-3.1.2-F0008	3.1.2	oas/3.1/3.1.2.md	332	OpenAPI Object	Fixed Fields	security	[Security Requirement Object]	false	false	A declaration of which security mechanisms can be used across the API. The list of values includes alternative Security Requirement Objects that can be used. Only one of the Security Requirement Objects need to be satisfied to authorize a request. Individual operations can override this definition. The list can be incomplete, up to being empty or absent. To make security explicitly optional, an empty security requirement (`{}`) can be included in the array.
OAS-3.1.2-F0009	3.1.2	oas/3.1/3.1.2.md	333	OpenAPI Object	Fixed Fields	tags	[Tag Object]	false	false	A list of tags used by the OpenAPI Description with additional metadata. The order of the tags can be used to reflect on their order by the parsing tools. Not all tags that are used by the [Operation Object](#operation-object) must be declared. The tags that are not declared MAY be organized randomly or based on the tools' logic. Each tag name in the list MUST be unique.
OAS-3.1.2-F0010	3.1.2	oas/3.1/3.1.2.md	334	OpenAPI Object	Fixed Fields	externalDocs	External Documentation Object	false	false	Additional external documentation.
OAS-3.1.2-F0011	3.1.2	oas/3.1/3.1.2.md	347	Info Object	Fixed Fields	title	string	false	true	**REQUIRED**. The title of the API.
OAS-3.1.2-F0012	3.1.2	oas/3.1/3.1.2.md	348	Info Object	Fixed Fields	summary	string	false	false	A short summary of the API.
OAS-3.1.2-F0013	3.1.2	oas/3.1/3.1.2.md	349	Info Object	Fixed Fields	description	string	false	false	A description of the API. [CommonMark syntax](https://spec.commonmark.org/) MAY be used for rich text representation.
OAS-3.1.2-F0014	3.1.2	oas/3.1/3.1.2.md	350	Info Object	Fixed Fields	termsOfService	string	false	false	A URI for the Terms of Service for the API. This MUST be in the form of a URI.
OAS-3.1.2-F0015	3.1.2	oas/3.1/3.1.2.md	351	Info Object	Fixed Fields	contact	Contact Object	false	false	The contact information for the exposed API.
OAS-3.1.2-F0016	3.1.2	oas/3.1/3.1.2.md	352	Info Object	Fixed Fields	license	License Object	false	false	The license information for the exposed API.
OAS-3.1.2-F0017	3.1.2	oas/3.1/3.1.2.md	353	Info Object	Fixed Fields	version	string	false	true	**REQUIRED**. The version of the OpenAPI Document (which is distinct from the [OpenAPI Specification version](#oas-version) or the version of the API being described or the version of the OpenAPI Description).
OAS-3.1.2-F0018	3.1.2	oas/3.1/3.1.2.md	401	Contact Object	Fixed Fields	name	string	false	false	The identifying name of the contact person/organization.
OAS-3.1.2-F0019	3.1.2	oas/3.1/3.1.2.md	402	Contact Object	Fixed Fields	url	string	false	false	The URI for the contact information. This MUST be in the form of a URI.
OAS-3.1.2-F0020	3.1.2	oas/3.1/3.1.2.md	403	Contact Object	Fixed Fields	email	string	false	false	The email address of the contact person/organization. This MUST be in the form of an email address.
OAS-3.1.2-F0021	3.1.2	oas/3.1/3.1.2.md	431	License Object	Fixed Fields	name	string	false	true	**REQUIRED**. The license name used for the API.
OAS-3.1.2-F0022	3.1.2	oas/3.1/3.1.2.md	432	License Object	Fixed Fields	identifier	string	false	false	An [SPDX](https://spdx.org/licenses/) license expression for the API. The `identifier` field is mutually exclusive of the `url` field.
OAS-3.1.2-F0023	3.1.2	oas/3.1/3.1.2.md	433	License Object	Fixed Fields	url	string	false	false	A URI for the license used for the API. This MUST be in the form of a URI. The `url` field is mutually exclusive of the `identifier` field.
OAS-3.1.2-F0024	3.1.2	oas/3.1/3.1.2.md	459	Server Object	Fixed Fields	url	string	false	true	**REQUIRED**. A URL to the target host. This URL supports Server Variables and MAY be relative, to indicate that the host location is relative to the location where the document containing the Server Object is being served. Query and fragment MUST NOT be part of this URL. Variable substitutions will be made when a variable is named in `{`braces`}`.
OAS-3.1.2-F0025	3.1.2	oas/3.1/3.1.2.md	460	Server Object	Fixed Fields	description	string	false	false	An optional string describing the host designated by the URL. [CommonMark syntax](https://spec.commonmark.org/) MAY be used for rich text representation.
OAS-3.1.2-F0026	3.1.2	oas/3.1/3.1.2.md	461	Server Object	Fixed Fields	variables	Map[string, Server Variable Object]	false	false	A map between a variable name and its value. The value is used for substitution in the server's URL template.
OAS-3.1.2-F0027	3.1.2	oas/3.1/3.1.2.md	565	Server Variable Object	Fixed Fields	enum	[string]	false	false	An enumeration of string values to be used if the substitution options are from a limited set. The array MUST NOT be empty.
OAS-3.1.2-F0028	3.1.2	oas/3.1/3.1.2.md	566	Server Variable Object	Fixed Fields	default	string	false	true	**REQUIRED**. The default value to use for substitution, which SHALL be sent if an alternate value is _not_ supplied. If the [`enum`](#server-variable-enum) is defined, the value MUST exist in the enum's values. Note that this behavior is different from the [Schema Object](#schema-object)'s `default` keyword, which documents the receiver's behavior rather than inserting the value into the data.
OAS-3.1.2-F0029	3.1.2	oas/3.1/3.1.2.md	567	Server Variable Object	Fixed Fields	description	string	false	false	An optional description for the server variable. [CommonMark syntax](https://spec.commonmark.org/) MAY be used for rich text representation.
OAS-3.1.2-F0030	3.1.2	oas/3.1/3.1.2.md	580	Components Object	Fixed Fields	schemas	Map[string, Schema Object]	false	false	An object to hold reusable [Schema Objects](#schema-object).
OAS-3.1.2-F0031	3.1.2	oas/3.1/3.1.2.md	581	Components Object	Fixed Fields	responses	Map[string, Response Object | Reference Object]	false	false	An object to hold reusable [Response Objects](#response-object).
OAS-3.1.2-F0032	3.1.2	oas/3.1/3.1.2.md	582	Components Object	Fixed Fields	parameters	Map[string, Parameter Object | Reference Object]	false	false	An object to hold reusable [Parameter Objects](#parameter-object).
OAS-3.1.2-F0033	3.1.2	oas/3.1/3.1.2.md	583	Components Object	Fixed Fields	examples	Map[string, Example Object | Reference Object]	false	false	An object to hold reusable [Example Objects](#example-object).
OAS-3.1.2-F0034	3.1.2	oas/3.1/3.1.2.md	584	Components Object	Fixed Fields	requestBodies	Map[string, Request Body Object | Reference Object]	false	false	An object to hold reusable [Request Body Objects](#request-body-object).
OAS-3.1.2-F0035	3.1.2	oas/3.1/3.1.2.md	585	Components Object	Fixed Fields	headers	Map[string, Header Object | Reference Object]	false	false	An object to hold reusable [Header Objects](#header-object).
OAS-3.1.2-F0036	3.1.2	oas/3.1/3.1.2.md	586	Components Object	Fixed Fields	securitySchemes	Map[string, Security Scheme Object | Reference Object]	false	false	An object to hold reusable [Security Scheme Objects](#security-scheme-object).
OAS-3.1.2-F0037	3.1.2	oas/3.1/3.1.2.md	587	Components Object	Fixed Fields	links	Map[string, Link Object | Reference Object]	false	false	An object to hold reusable [Link Objects](#link-object).
OAS-3.1.2-F0038	3.1.2	oas/3.1/3.1.2.md	588	Components Object	Fixed Fields	callbacks	Map[string, Callback Object | Reference Object]	false	false	An object to hold reusable [Callback Objects](#callback-object).
OAS-3.1.2-F0039	3.1.2	oas/3.1/3.1.2.md	589	Components Object	Fixed Fields	pathItems	Map[string, Path Item Object]	false	false	An object to hold reusable [Path Item Objects](#path-item-object).
OAS-3.1.2-F0040	3.1.2	oas/3.1/3.1.2.md	788	Paths Object	Patterned Fields	/{path}	Path Item Object	true	false	A relative path to an individual endpoint. The field name MUST begin with a forward slash (`/`). The path is **appended** (no relative URL resolution) to the expanded URL from the [Server Object](#server-object)'s `url` field in order to construct the full URL. [Path templating](#path-templating) is allowed. When matching URLs, concrete (non-templated) paths would be matched before their templated counterparts. Templated paths with the same hierarchy but different templated names MUST NOT exist as they are identical. In case of ambiguous matching, it's up to the tooling to decide which one to use.
OAS-3.1.2-F0041	3.1.2	oas/3.1/3.1.2.md	867	Path Item Object	Fixed Fields	$ref	string	false	false	Allows for a referenced definition of this path item. The value MUST be in the form of a URI, and the referenced structure MUST be in the form of a [Path Item Object](#path-item-object). In case a Path Item Object field appears both in the defined object and the referenced object, the behavior is undefined. See the rules for resolving [Relative References](#relative-references-in-api-description-uris). <br><br>_**Note:** The behavior of `$ref` with adjacent properties is likely to change in future versions of this specification to bring it into closer alignment with the behavior of the [Reference Object](#reference-object)._
OAS-3.1.2-F0042	3.1.2	oas/3.1/3.1.2.md	868	Path Item Object	Fixed Fields	summary	string	false	false	An optional string summary, intended to apply to all operations in this path.
OAS-3.1.2-F0043	3.1.2	oas/3.1/3.1.2.md	869	Path Item Object	Fixed Fields	description	string	false	false	An optional string description, intended to apply to all operations in this path. [CommonMark syntax](https://spec.commonmark.org/) MAY be used for rich text representation.
OAS-3.1.2-F0044	3.1.2	oas/3.1/3.1.2.md	870	Path Item Object	Fixed Fields	get	Operation Object	false	false	A definition of a GET operation on this path.
OAS-3.1.2-F0045	3.1.2	oas/3.1/3.1.2.md	871	Path Item Object	Fixed Fields	put	Operation Object	false	false	A definition of a PUT operation on this path.
OAS-3.1.2-F0046	3.1.2	oas/3.1/3.1.2.md	872	Path Item Object	Fixed Fields	post	Operation Object	false	false	A definition of a POST operation on this path.
OAS-3.1.2-F0047	3.1.2	oas/3.1/3.1.2.md	873	Path Item Object	Fixed Fields	delete	Operation Object	false	false	A definition of a DELETE operation on this path.
OAS-3.1.2-F0048	3.1.2	oas/3.1/3.1.2.md	874	Path Item Object	Fixed Fields	options	Operation Object	false	false	A definition of a OPTIONS operation on this path.
OAS-3.1.2-F0049	3.1.2	oas/3.1/3.1.2.md	875	Path Item Object	Fixed Fields	head	Operation Object	false	false	A definition of a HEAD operation on this path.
OAS-3.1.2-F0050	3.1.2	oas/3.1/3.1.2.md	876	Path Item Object	Fixed Fields	patch	Operation Object	false	false	A definition of a PATCH operation on this path.
OAS-3.1.2-F0051	3.1.2	oas/3.1/3.1.2.md	877	Path Item Object	Fixed Fields	trace	Operation Object	false	false	A definition of a TRACE operation on this path.
OAS-3.1.2-F0052	3.1.2	oas/3.1/3.1.2.md	878	Path Item Object	Fixed Fields	servers	[Server Object]	false	false	An alternative `servers` array to service all operations in this path. If a `servers` array is specified at the [OpenAPI Object](#oas-servers) level, it will be overridden by this value.
OAS-3.1.2-F0053	3.1.2	oas/3.1/3.1.2.md	879	Path Item Object	Fixed Fields	parameters	[Parameter Object | Reference Object]	false	false	A list of parameters that are applicable for all the operations described under this path. These parameters can be overridden at the operation level, but cannot be removed there. The list MUST NOT include duplicated parameters. A unique parameter is defined by a combination of a [name](#parameter-name) and [location](#parameter-in). The list can use the [Reference Object](#reference-object) to link to parameters that are defined in the [OpenAPI Object's `components.parameters`](#components-parameters).
OAS-3.1.2-F0054	3.1.2	oas/3.1/3.1.2.md	975	Operation Object	Fixed Fields	tags	[string]	false	false	A list of tags for API documentation control. Tags can be used for logical grouping of operations by resources or any other qualifier.
OAS-3.1.2-F0055	3.1.2	oas/3.1/3.1.2.md	976	Operation Object	Fixed Fields	summary	string	false	false	A short summary of what the operation does.
OAS-3.1.2-F0056	3.1.2	oas/3.1/3.1.2.md	977	Operation Object	Fixed Fields	description	string	false	false	A verbose explanation of the operation behavior. [CommonMark syntax](https://spec.commonmark.org/) MAY be used for rich text representation.
OAS-3.1.2-F0057	3.1.2	oas/3.1/3.1.2.md	978	Operation Object	Fixed Fields	externalDocs	External Documentation Object	false	false	Additional external documentation for this operation.
OAS-3.1.2-F0058	3.1.2	oas/3.1/3.1.2.md	979	Operation Object	Fixed Fields	operationId	string	false	false	Unique string used to identify the operation. The id MUST be unique among all operations described in the API. The operationId value is **case-sensitive**. Tools and libraries MAY use the operationId to uniquely identify an operation, therefore, it is RECOMMENDED to follow common programming naming conventions.
OAS-3.1.2-F0059	3.1.2	oas/3.1/3.1.2.md	980	Operation Object	Fixed Fields	parameters	[Parameter Object | Reference Object]	false	false	A list of parameters that are applicable for this operation. If a parameter is already defined at the [Path Item](#path-item-parameters), the new definition will override it but can never remove it. The list MUST NOT include duplicated parameters. A unique parameter is defined by a combination of a [name](#parameter-name) and [location](#parameter-in). The list can use the [Reference Object](#reference-object) to link to parameters that are defined in the [OpenAPI Object's `components.parameters`](#components-parameters).
OAS-3.1.2-F0060	3.1.2	oas/3.1/3.1.2.md	981	Operation Object	Fixed Fields	requestBody	Request Body Object | Reference Object	false	false	The request body applicable for this operation. The `requestBody` is fully supported in HTTP methods where the HTTP 1.1 specification [RFC7231](https://tools.ietf.org/html/rfc7231#section-4.3.1) has explicitly defined semantics for request bodies. In other cases where the HTTP spec is vague (such as [GET](https://tools.ietf.org/html/rfc7231#section-4.3.1), [HEAD](https://tools.ietf.org/html/rfc7231#section-4.3.2) and [DELETE](https://tools.ietf.org/html/rfc7231#section-4.3.5)), `requestBody` is permitted but does not have well-defined semantics and SHOULD be avoided if possible.
OAS-3.1.2-F0061	3.1.2	oas/3.1/3.1.2.md	982	Operation Object	Fixed Fields	responses	Responses Object	false	false	The list of possible responses as they are returned from executing this operation.
OAS-3.1.2-F0062	3.1.2	oas/3.1/3.1.2.md	983	Operation Object	Fixed Fields	callbacks	Map[string, Callback Object | Reference Object]	false	false	A map of possible out-of band callbacks related to the parent operation. The key is a unique identifier for the Callback Object. Each value in the map is a [Callback Object](#callback-object) that describes a request that may be initiated by the API provider and the expected responses.
OAS-3.1.2-F0063	3.1.2	oas/3.1/3.1.2.md	984	Operation Object	Fixed Fields	deprecated	boolean	false	false	Declares this operation to be deprecated. Consumers SHOULD refrain from usage of the declared operation. Default value is `false`.
OAS-3.1.2-F0064	3.1.2	oas/3.1/3.1.2.md	985	Operation Object	Fixed Fields	security	[Security Requirement Object]	false	false	A declaration of which security mechanisms can be used for this operation. The list of values includes alternative Security Requirement Objects that can be used. Only one of the Security Requirement Objects need to be satisfied to authorize a request. To make security optional, an empty security requirement (`{}`) can be included in the array. This definition overrides any declared top-level [`security`](#oas-security). To remove a top-level security declaration, an empty array can be used.
OAS-3.1.2-F0065	3.1.2	oas/3.1/3.1.2.md	986	Operation Object	Fixed Fields	servers	[Server Object]	false	false	An alternative `servers` array to service this operation. If a `servers` array is specified at the [Path Item Object](#path-item-servers) or [OpenAPI Object](#oas-servers) level, it will be overridden by this value.
